{
  "$schema": "components.schema.json",
  "version": "0.1.0",
  "prefix": "t-",
  "token_prefix": "--t-",
  "tones": [
    "neutral",
    "accent",
    "success",
    "warning",
    "danger",
    "info",
    "text",
    "red",
    "orange",
    "yellow",
    "green",
    "cyan",
    "purple",
    "pink"
  ],
  "sizes": [
    "xs",
    "sm",
    "md",
    "lg",
    "xl"
  ],
  "groups": {
    "shell": "App shell & layout",
    "actions": "Actions",
    "navigation": "Navigation",
    "forms": "Forms",
    "data": "Data display",
    "feedback": "Feedback"
  },
  "components": [
    {
      "id": "app-shell",
      "name": "App shell",
      "tier": 1,
      "group": "shell",
      "description": "The page frame: sticky navbar, main column spanning the full width, fixed footer; a sidebar column appears only when a .t-shell-side child is present (sticky, scrolls on its own). Stacks below 992px.",
      "root": "t-shell",
      "parts": {
        "t-shell-nav": "navbar slot (a .t-navbar)",
        "t-shell-side": "sidebar slot (holds a .t-sidebar)",
        "t-shell-main": "main content column",
        "t-shell-foot": "footer slot (a .t-footer)"
      },
      "attributes": {
        "data-sidebar": [
          "none",
          "collapsed"
        ]
      },
      "behaviour": "none",
      "a11y": "<header>, <aside>, <main>, <footer> landmarks; exactly one <main>. A shell without a sidebar needs no attribute (omit .t-shell-side); data-sidebar=none hides an existing one, collapsed narrows it.",
      "markup": "<div class='t-shell'>\n  <header class='t-navbar t-shell-nav'>…</header>\n  <aside class='t-shell-side'><nav class='t-sidebar' aria-label='Sections'>…</nav></aside>\n  <main class='t-shell-main t-page'>…</main>\n  <footer class='t-footer t-shell-foot'>…</footer>\n</div>",
      "demo": "<div class='t-shell t-demo-shell' data-demo='mock'>\n  <header class='t-navbar t-shell-nav'><a class='t-navbar-brand' href='#'>console</a><ul class='t-navbar-nav'><li><a class='t-navbar-link' href='#' aria-current='page'>Services</a></li><li><a class='t-navbar-link' href='#'>Hosts</a></li></ul></header>\n  <aside class='t-shell-side'><nav class='t-sidebar' aria-label='Mock'><ul><li class='t-sidebar-group'>Fleet</li><li><a class='t-sidebar-item' href='#' aria-current='page'><span class='t-sidebar-item-name'>Overview</span></a></li><li><a class='t-sidebar-item' href='#'><span class='t-sidebar-item-name'>Devices</span><span class='t-counter'>12</span></a></li></ul></nav></aside>\n  <main class='t-shell-main t-page'><header class='t-page-header'><h1 class='t-page-title'>Services</h1></header><p class='t-muted'>Main column scrolls; sidebar and navbar stay.</p></main>\n  <footer class='t-footer t-shell-foot'><span class='t-footer-version'>v0.9.2</span></footer>\n</div>",
      "notes": "layout.css owns the geometry (--t-nav-h, --t-footer-h, --t-sidebar-w, --t-gutter). Skins colour the slots via .t-navbar/.t-sidebar/.t-footer, never reposition them.",
      "source": "reference/index.html shell-mock, dracula.css .main-content"
    },
    {
      "id": "navbar",
      "name": "Navbar",
      "tier": 1,
      "group": "shell",
      "description": "Top bar: brand left, links right, separators, end slot (picker, theme toggle).",
      "root": "t-navbar",
      "parts": {
        "t-navbar-brand": "icon + app name link",
        "t-navbar-nav": "<ul> of links",
        "t-navbar-link": "a link; aria-current=page marks the active one",
        "t-navbar-sep": "thin vertical rule",
        "t-navbar-end": "right-aligned slot"
      },
      "states": [
        "aria-current=page",
        ":hover"
      ],
      "behaviour": "none",
      "a11y": "<header> or <nav aria-label>; active page via aria-current=page, never a class.",
      "markup": "<header class='t-navbar'>\n  <a class='t-navbar-brand' href='/'><svg class='t-icon' aria-hidden='true'><use href='/tailor/icons.svg#bi-terminal'/></svg>console</a>\n  <ul class='t-navbar-nav'>\n    <li><a class='t-navbar-link' href='/services' aria-current='page'>Services</a></li>\n    <li><a class='t-navbar-link' href='/hosts'>Hosts</a></li>\n  </ul>\n  <span class='t-navbar-sep'></span>\n  <div class='t-navbar-end'>…picker…</div>\n</header>",
      "source": "navigation.css, dracula.css .navbar"
    },
    {
      "id": "sidebar",
      "name": "Sidebar",
      "tier": 1,
      "group": "shell",
      "description": "Vertical nav: group headers, items with icon + name + trailing counter/dot, nested groups via <details>, dividers. Also the settings-tabs pattern.",
      "root": "t-sidebar",
      "parts": {
        "t-sidebar-group": "small-caps group header <li>",
        "t-sidebar-item": "link/button/summary row; aria-current=page = active",
        "t-sidebar-item-name": "truncating label",
        "t-sidebar-nested": "nested <ul> inside <details>",
        "t-sidebar-chevron": "turns when the <details> is open",
        "t-sidebar-divider": "rule <li>"
      },
      "states": [
        "aria-current=page",
        ":hover",
        ":disabled / aria-disabled=true",
        "details[open]"
      ],
      "behaviour": "js:Tailor.scrollspy (optional)",
      "a11y": "<nav aria-label> > <ul>; nested groups are <details><summary class='t-sidebar-item'> so they work without JS.",
      "markup": "<nav class='t-sidebar' aria-label='Sections'>\n  <ul>\n    <li class='t-sidebar-group'>Overview</li>\n    <li><a class='t-sidebar-item' href='#dash' aria-current='page'><svg class='t-icon' aria-hidden='true'><use href='/tailor/icons.svg#bi-grid'/></svg><span class='t-sidebar-item-name'>Dashboard</span></a></li>\n    <li><a class='t-sidebar-item' href='#alerts'><svg class='t-icon' aria-hidden='true'><use href='/tailor/icons.svg#bi-exclamation-triangle'/></svg><span class='t-sidebar-item-name'>Alerts</span><span class='t-counter' data-tone='danger'>3</span></a></li>\n    <li><details open><summary class='t-sidebar-item'><svg class='t-icon' aria-hidden='true'><use href='/tailor/icons.svg#bi-list'/></svg><span class='t-sidebar-item-name'>Devices</span><span class='t-counter'>12</span><span class='t-sidebar-chevron'></span></summary>\n      <ul class='t-sidebar-nested'><li><a class='t-sidebar-item' href='#d1'><span class='t-dot' data-status='running'></span><span class='t-sidebar-item-name'>epaper-display</span></a></li></ul></details></li>\n    <li class='t-sidebar-divider'></li>\n    <li><a class='t-sidebar-item' href='#settings'><svg class='t-icon' aria-hidden='true'><use href='/tailor/icons.svg#bi-gear'/></svg><span class='t-sidebar-item-name'>Settings</span></a></li>\n  </ul>\n</nav>",
      "source": "sidebar.css"
    },
    {
      "id": "footer",
      "name": "Footer",
      "tier": 1,
      "group": "shell",
      "description": "32px fixed footer: repo icon centred, version + theme/palette toggle right.",
      "root": "t-footer",
      "parts": {
        "t-footer-repo": "centred repo link",
        "t-footer-end": "right-aligned group; the switcher ([data-tailor-pickers] → .t-pickers) is its first item",
        "t-pickers": "the rendered switcher: sun/moon toggle, then skin/palette selects",
        "t-footer-version": "monospace version string"
      },
      "behaviour": "none",
      "markup": "<footer class='t-footer'>\n  <a class='t-footer-repo' href='https://github.com/…' data-tip='Repository' aria-label='Repository'><svg class='t-icon' aria-hidden='true'><use href='/tailor/icons.svg#bi-github'/></svg></a>\n  <div class='t-footer-end'><div data-tailor-pickers></div><span class='t-footer-version'>v0.9.2</span></div>\n</footer>",
      "demo": "<footer class='t-footer'>\n  <a class='t-footer-repo' href='#' data-tip='Repository' aria-label='Repository'><svg class='t-icon' aria-hidden='true'><use href='/tailor/icons.svg#bi-github'/></svg></a>\n  <div class='t-footer-end'><div class='t-pickers'><button type='button' class='t-btn' data-variant='ghost' data-size='sm' data-icon='only' aria-label='Switch to light mode' data-demo='static'><svg class='t-icon' aria-hidden='true'><use href='/tailor/icons.svg#bi-sun'/></svg></button></div><span class='t-footer-version'>tailor 0.1.0</span></div>\n</footer>",
      "source": "footer.css"
    },
    {
      "id": "page",
      "name": "Page",
      "tier": 1,
      "group": "shell",
      "description": "Main column content wrapper with the page header row: back link, title, lead, actions.",
      "root": "t-page",
      "parts": {
        "t-page-header": "header row (flex, wraps)",
        "t-page-back": "back link/button (mandatory on orphan sub-pages)",
        "t-page-title": "h1",
        "t-page-lead": "muted one-liner next to / under the title",
        "t-page-actions": "right-aligned action group"
      },
      "behaviour": "none",
      "a11y": "Exactly one h1 per page, in .t-page-title.",
      "markup": "<main class='t-page'>\n  <header class='t-page-header'>\n    <a class='t-page-back' href='/services' aria-label='Back to services'>←</a>\n    <h1 class='t-page-title'>render</h1>\n    <span class='t-page-lead'>console service · web-1</span>\n    <div class='t-page-actions'><button class='t-btn' data-variant='primary'>Deploy</button></div>\n  </header>\n  …\n</main>",
      "demo": "<div class='t-page' style='padding:0'>\n  <header class='t-page-header'>\n    <a class='t-page-back' href='#page' aria-label='Back'>←</a>\n    <h1 class='t-page-title'>render</h1>\n    <span class='t-page-lead'>console service · web-1</span>\n    <div class='t-page-actions'><button class='t-btn' data-variant='secondary'>Logs</button><button class='t-btn' data-variant='primary'>Deploy</button></div>\n  </header>\n</div>",
      "source": "SKILL.md Layout, Spacing"
    },
    {
      "id": "section",
      "name": "Section",
      "tier": 1,
      "group": "shell",
      "description": "A titled block inside a page or card: small-caps label with a rule, then content.",
      "root": "t-section",
      "parts": {